"country","dividendexempt","capgainsexemption","countrylimitations","divwithhold","intwithhold","roywithhold","taxtreaties","cfcrules","cfc_income","cfc_exemption","thincap"
"","Participation Exemption","","","Withholding Taxes","","","","International Tax Regulations","","",""
"Country","Dividend Exemption","Capital Gains Exemption","Country Limitations","Dividend Withholding Tax","Interest Withholding Tax","Royalties Withholding Tax","Number of Tax Treaties","Controlled Foreign Corporation Rules","Controlled Foreign Corporation Rules: Income","Controlled Foreign Corporation Rules: Exemptions","Interest Deduction Limitations"
"Australia","100.0%","100.0%","None","30.0%","10.0%","30.0%","44","Yes","Passive","CFC exempt if located in a “listed” country or if it passes the active income test","1.5:1 debt-to-equity ratio (15:1 for financial institutions) applies"
"Austria","100.0%","100.0%","None","27.5%","0.0%","20.0%","89","Yes","Passive","CFC with substantive economic activities exempted","Informal 4:1 debt-to-equity ratio applies"
"Belgium","100.0%","100.0%","None","30.0%","30.0%","30.0%","95","Yes","All Income Associated with Non-genuine Arrangements","None","Interest deductions limited to the higher of €3 million or 30% of EBITDA
5:1 debt-to-equity ratio applies to intragroup loans
1:1 debt-to-equity ratio applies to receivables from shareholders or directors, managers, and liquidators"
"Canada","100.0%","50.0%","Countries with a tax treaty or Tax Information Exchange Agreement","25.0%","25.0%","25.0%","94","Yes","Passive","Multiple rules may exempt CFC from taxation","1.5:1 debt-to-equity ratio applies"
"Chile","0.0%","0.0%","N/A","35.0%","35.0%","30.0%","33","Yes","Passive","None","3:1 debt-to-equity ratio applies
A surtax for excessive-indebtedness can apply"
"Czech Republic","100.0%","100.0%","EU member states and EEA member states","15.0%","15.0%","15.0%","89","Yes","Passive","CFC with substantive economic activities exempted","4:1 debt-to-equity ratio (6:1 debt-to-equity ratio for certain financial services companies) applies"
"Denmark","100.0%","100.0%","EU member states and EEA member states or double tax treaty","27.0%","22.0%","22.0%","75","Yes","All Income","Foreign subsidiaries are exempt if less than 1/3 of their income is financial income","4:1 debt-to-equity ratio applies
Interest deductions are limited to 2.7% of assets
Interest and depreciation deduction limited to 30% of EBITDA
Other rules can apply"
"Estonia","100.0%","100.0%","EU member states and EEA member states and Switzerland","0.0%","0.0%","10.0%","58","Yes","All Income Associated with Non-genuine Arrangements","CFC exempt if profits below €750,000 or passive income below €75,000","Interest deductions limited to the higher of €3 million or 30% of EBITDA"
"Finland","100.0%","100.0%","EU member states and EEA member states","20.0%","0.0%","20.0%","76","Yes","All Income","CFC exempt if i) located in EU or EEA and not an artificial arrangement; ii) industrial, manufacturing, and shipping business; or iii) Finland has a double-tax treaty with the foreign country (excluding tax treaty countries mentioned in a ""black list"")","Interest deductions limited to 25% of EBITDA
Net interest expenses between non-related parties limited to €3 million"
"France","95.0%","88.0%","Black-list countries are excluded","30.0%","0.0%","33.3%","122","Yes","All Income","CFC exempt if located in EU or EEA and not an artificial arrangement, or if CFC carries out trading or manufacturing activity","Interest deductions limited to the higher of €3 million or 30% of EBITDA"
"Germany","95.0%","95.0%","None","26.4%","0.0%","15.8%","96","Yes","Passive","CFC exempt if located in EU or EEA and not an artificial arrangement","Interest deductions limited to the higher of €3 million or 30% of EBITDA"
"Greece","100.0%","0.0%","EU member states","10.0%","15.0%","20.0%","57","Yes","Passive","CFC exempt if located in EU or EEA country with exchange of information agreement and not an artificial arrangement","Interest deductions limited to the higher of €3 million or 30% of EBITDA"
"Hungary","100.0%","100.0%","None","0.0%","0.0%","0.0%","81","Yes","Passive","CFC exempt if i) real economic activity; ii) below certain profit threshold and ratio; or iii) located in country with treaty allowing for an exemption","Interest deductions limited to the higher of €3 million or 30% of EBITDA"
"Iceland","100.0%","100.0%","None","20.0%","12.0%","20.0%","45","Yes","All Income","CFC exempt if located in EEA countries or has a double-tax treaty with Iceland and not an artificial arrangement","Interest deductions limited to 30% of EBITDA
Rule does not apply if total interest paid does not exceed ISK 100 million 
Other exemptions can apply"
"Ireland","0.0%","100.0%","EU member states and tax treaty countries","20.0%","20.0%","20.0%","73","Yes","All Income Associated with Non-genuine Arrangements","CFC exempt if i) below certain profit and income thresholds; ii) transfer pricing rules apply; or iii) passes the essential purpose test.","None
However, in specific cases, interest can be reclassified as a dividend"
"Israel","0.0%","0.0%","N/A","30.0%","23.0%","23.0%","56","Yes","Passive","None","None"
"Italy","95.0%","95.0%","Black-list countries are excluded","26.0%","26.0%","22.5%","100","Yes","All Income","CFC exempt if located in EU or EEA and not an artificial arrangement 
Other exemptions can also apply","Interest deductions limited to 30% of EBITDA"
"Japan","95.0%","0.0%","None","20.0%","20.0%","20.0%","69","Yes","All Income","Various exemptions can apply","3:1 debt-to-equity ratio (2:1 for particular repo transactions) applies"
"Korea","0.0%","0.0%","N/A","22.0%","22.0%","22.0%","93","Yes","All Income","CFC rules don't apply to active income if CFC has fixed facilities engaged in business in the foreign country","2:1 debt-to-equity ratio (6:1 for financial institutions) applies
Interest deductions limited to 30% of EBITDA (financial institutions exempt)"
"Latvia","100.0%","100.0%","Black-list countries are excluded","0.0%","0.0%","0.0%","61","Yes","All Income Associated with Non-genuine Arrangements","CFC exempt if profits below €750,000 or passive income below €75,000 and CFC is not based or incorporated in a tax haven","4:1 debt-to-equity ratio applies (certain financial institutions exempt)
Interest deductions limited if interest payments both exceed €3 million and 30% of EBITDA"
"Lithuania","100.0%","100.0%","Black-list countries are excluded","15.0%","10.0%","10.0%","54","Yes","Passive","CFC exempt if country included in white list and not receiving special tax treatment or taxed subject to a corporate rate of more than 11.25%","4:1 debt-to-equity ratio applies
Interest deductions limited to the higher of €3 million or 30% of EBITDA
Rule does not apply if entity's debt-to-equity ratio is not (or at most 2 percentage-points) lower than the group-consolidated ratio"
"Luxembourg","100.0%","100.0%","None","15.0%","0.0%","0.0%","82","Yes","All Income Associated with Non-genuine Arrangements","CFC exempt if i) not an artificial arrangement or ii) accounting profits below €750,000 or less than 10% of operating costs","Informal 85:15 debt-to-equity ratio applies
Interest deductions limited to the higher of 30% of EBITDA or €3 million (financial institutions exempt)"
"Mexico","0.0%","0.0%","N/A","10.0%","35.0%","35.0%","59","Yes","All Income","None","3:1 debt-to-equity ratio applies"
"Netherlands","100.0%","100.0%","None","15.0%","0.0%","0.0%","97","Yes","Passive","CFC exempt if not an artificial arrangement","Interest deductions limited to the higher of €1 million or 30% of EBITDA"
"New Zealand","100.0%","100.0%","None","30.0%","15.0%","15.0%","40","Yes","Passive","Limited exemption for certain Australian CFCs","Numerous restrictions on debt-to-equity ratio apply"
"Norway","97.0%","100.0%","EEA member states","25.0%","0.0%","0.0%","87","Yes","All Income","CFC exempt if located in EEA country and not an artificial arrangement or located in tax treaty country","Interest deductions limited to 25% of EBITDA"
"Poland","100.0%","0.0%","EU member states and EEA member states and Switzerland","19.0%","20.0%","20.0%","85","Yes","All Income","CFC exempt if located in EU or EEA and not an artificial arrangement","Interest deductions limited to the higher of PLN 3 million or 30% of EBITDA"
"Portugal","100.0%","100.0%","Black-list countries are excluded","25.0%","25.0%","25.0%","77","Yes","All Income","CFC exempt if located in EU and EEA countries and not an artificial arrangement
Other exemptions can apply","Interest deductions limited to the higher of €1 million or 30% of EBITDA"
"Slovak Republic","100.0%","100.0%","Tax treaty countries","35.0%","19.0%","19.0%","70","Yes","All Income Associated with Non-genuine Arrangements","None","Interest deductions limited to 25% of EBITDA (financial institutions exempted)"
"Slovenia","95.0%","47.5%","Black-list countries are excluded","15.0%","15.0%","15.0%","59","Yes","Passive","Substantial economic activities exemption","4:1 debt-to-equity ratio applies"
"Spain","100.0%","100.0%","Black-list countries are excluded","19.0%","19.0%","24.0%","93","Yes","Passive","CFC exempt if located in EU or EEA and not an artificial arrangement","Interest deductions limited to the higher of €1 million or 30% of EBITDA"
"Sweden","100.0%","100.0%","None","30.0%","0.0%","0.0%","81","Yes","All Income","CFC exempt if located in EEA and not an artificial arrangement or located in white list countries","Interest deductions limited to 30% of EBITDA"
"Switzerland","100.0%","100.0%","None","35.0%","35.0%","0.0%","93","No","N/A","N/A","Debt-to-equity ratios apply and vary by asset class"
"Turkey","100.0%","100.0%","None","15.0%","10.0%","20.0%","85","Yes","All Income","None","3:1 debt-to-equity ratio (6:1 for financial institutions) applies"
"United Kingdom","100.0%","100.0%","None","0.0%","20.0%","20.0%","129","Yes","All Income","Various exemptions can apply","Interest deductions limited to 30% of EBITDA"
"United States","100.0%","0.0%","None","30.0%","30.0%","30.0%","65","Yes","Passive","Exemptions for foreign high-taxed income can apply","Interest deductions limited to the sum of business interest income, 30% of adjusted taxable income, and floor plan financing interest"
